{
  "$schema": "../tradition-pack.schema.json",
  "schemaVersion": "1",
  "kind": "oh-my-saju-tradition-pack",
  "id": "sanming-symbolic-curated",
  "version": "1.2.0",
  "displayName": "삼명통회 엄선 신살",
  "compatibility": {
    "coreEngineSchemaVersions": ["5"],
    "runtimeContract": "oh-my-saju-tradition-runtime-v1"
  },
  "knowledge": {
    "providerContract": "tradition-knowledge-provider-v1",
    "adapter": "static-files",
    "supportedAdapters": ["static-files", "ontology-snapshot", "knowledge-graph-snapshot"],
    "snapshot": {
      "kind": "static-file-snapshot",
      "version": "1.0.0",
      "immutability": "content-addressed",
      "algorithm": "sha256",
      "canonicalization": "ordered-file-bytes-with-path-v1",
      "digest": "b2ebb931f65e2ae14d6e8f7ab7e031eaff2225cf97e375db9c4ec0d3f00dffc9",
      "provenanceContract": "tradition-provenance-v1",
      "queryContract": "static-resource-query-v1"
    },
    "sources": ["sources.json"],
    "tables": [],
    "rules": ["rules.json", "profile.ts", "evaluate.ts"],
    "fixtures": ["fixtures.json"],
    "provenance": ["provenance.json"]
  },
  "runtime": {
    "execution": "statically-registered-built-in",
    "profileModule": "profile.ts",
    "helperModules": ["evaluate.ts"]
  },
  "outputContract": {
    "kind": "isolated-finding-set",
    "profileIsolation": "no-cross-pack-voting"
  },
  "ontology": {
    "namespace": "urn:oh-my-saju:tradition:sanming-symbolic-curated:v1",
    "materialization": "not-built",
    "snapshot": null
  }
}
