{
  "$schema": "../tradition-pack.schema.json",
  "schemaVersion": "1",
  "kind": "oh-my-saju-tradition-pack",
  "id": "ditianshui",
  "version": "1.2.0",
  "displayName": "적천수 왕쇠 근거",
  "compatibility": {
    "coreEngineSchemaVersions": ["5"],
    "runtimeContract": "oh-my-saju-tradition-runtime-v1"
  },
  "knowledge": {
    "providerContract": "tradition-knowledge-provider-v1",
    "adapter": "static-files",
    "supportedAdapters": ["static-files", "ontology-snapshot", "knowledge-graph-snapshot"],
    "snapshot": {
      "kind": "static-file-snapshot",
      "version": "1.0.0",
      "immutability": "content-addressed",
      "algorithm": "sha256",
      "canonicalization": "ordered-file-bytes-with-path-v1",
      "digest": "7eb9146ade9a98e557208137bcdcd5fae5f5675e5b28ddbc98e988d67b919119",
      "provenanceContract": "tradition-provenance-v1",
      "queryContract": "static-resource-query-v1"
    },
    "sources": ["sources.json"],
    "tables": [
      "seasonal-state-table.json",
      "root-rank-v1.json",
      "strength-score-v1.json",
      "follow-transform-v1.json"
    ],
    "rules": ["rules.json", "profile.ts", "evaluate.ts"],
    "fixtures": ["fixtures.json"],
    "provenance": ["provenance.json"]
  },
  "runtime": {
    "execution": "statically-registered-built-in",
    "profileModule": "profile.ts",
    "helperModules": ["evaluate.ts"]
  },
  "outputContract": {
    "kind": "isolated-finding-set",
    "profileIsolation": "no-cross-pack-voting"
  },
  "ontology": {
    "namespace": "urn:oh-my-saju:tradition:ditianshui:v1",
    "materialization": "not-built",
    "snapshot": null
  }
}
